{
  "base0": "",
  "base1a": "",
  "base1": "",
  "base2": "",
  "base3": "",
  "base4": "",
  "text": "",
  "testsuite-red": "",
  "testsuite-green": "",
  "editor-selection-match": "",
  "editor-activeline": "",
  "button-hover": "",
  "button-active": "",
  "sp-highlight": "",
  "fp-highlight": "",
  "border": "",
  "regtable-special": "",
  "regtable-temp": "",
  "regtable-arg": "",
  "regtable-saved": "",
  "pseudoinst": "",
  "inst": "",
  "addrcolumn": "",
  "debugging": "",
  "editor-caret": "",
  "editor-insn": "",
  "editor-reg": "",
  "editor-const": "",
  "editor-string": "",
  "editor-directive": "",
  "editor-comment": ""
}